{"adapters":["generic","openai","ollama"],"authority":{"adapter_output_is_source_evidence":false,"transport_conformance_is_not_parent_compatibility":true},"derived_noncanonical":true,"fingerprint_sha256":"9ee78e67d22a97e951c8867587aa55f0601ae5169fe62c60ebcfaaf83fd64062","identity":{"contract":"ai/adapter-contract.json","contract_sha256":"a47162f165679a992bd66a77c1e66b15e42b7e2774240e123288015f4c13142a","index":"adapters/index.json","index_sha256":"7313e44e7a1e23e411db35060b37bb1d05f917e418d0d18fb960db8f3db96f10"},"protocol":"QSOL-INT/ADAPTER/1","results":[{"adapter":"generic","errors":[],"expected":{"decision":"allow","failure_code":null},"fixture":"adapters/fixtures/valid.json","fixture_sha256":"63dc4481a26381ce0eb9f49dca7deb043691cf50bfe87f84dccfa6050901c1c5","observed":{"decision":"allow","failure_code":null},"result":"pass"},{"adapter":"openai","errors":[],"expected":{"decision":"allow","failure_code":null},"fixture":"adapters/fixtures/valid.json","fixture_sha256":"63dc4481a26381ce0eb9f49dca7deb043691cf50bfe87f84dccfa6050901c1c5","observed":{"decision":"allow","failure_code":null},"result":"pass"},{"adapter":"ollama","errors":[],"expected":{"decision":"allow","failure_code":null},"fixture":"adapters/fixtures/valid.json","fixture_sha256":"63dc4481a26381ce0eb9f49dca7deb043691cf50bfe87f84dccfa6050901c1c5","observed":{"decision":"allow","failure_code":null},"result":"pass"},{"adapter":"generic","errors":[],"expected":{"decision":"allow","failure_code":null},"fixture":"adapters/fixtures/unknown.json","fixture_sha256":"4fa0d16488dcd530d3807fb8792d4249cb5d5d3032c9d7839ad292051927c5ac","observed":{"decision":"allow","failure_code":null},"result":"pass"},{"adapter":"openai","errors":[],"expected":{"decision":"allow","failure_code":null},"fixture":"adapters/fixtures/unknown.json","fixture_sha256":"4fa0d16488dcd530d3807fb8792d4249cb5d5d3032c9d7839ad292051927c5ac","observed":{"decision":"allow","failure_code":null},"result":"pass"},{"adapter":"ollama","errors":[],"expected":{"decision":"allow","failure_code":null},"fixture":"adapters/fixtures/unknown.json","fixture_sha256":"4fa0d16488dcd530d3807fb8792d4249cb5d5d3032c9d7839ad292051927c5ac","observed":{"decision":"allow","failure_code":null},"result":"pass"},{"adapter":"generic","errors":[],"expected":{"decision":"allow","failure_code":null},"fixture":"adapters/fixtures/conflict.json","fixture_sha256":"4872390a79cafb57adf49b2f2c52c687c653c3c52c4e712a5b76e08e5a1f7e4c","observed":{"decision":"allow","failure_code":null},"result":"pass"},{"adapter":"openai","errors":[],"expected":{"decision":"allow","failure_code":null},"fixture":"adapters/fixtures/conflict.json","fixture_sha256":"4872390a79cafb57adf49b2f2c52c687c653c3c52c4e712a5b76e08e5a1f7e4c","observed":{"decision":"allow","failure_code":null},"result":"pass"},{"adapter":"ollama","errors":[],"expected":{"decision":"allow","failure_code":null},"fixture":"adapters/fixtures/conflict.json","fixture_sha256":"4872390a79cafb57adf49b2f2c52c687c653c3c52c4e712a5b76e08e5a1f7e4c","observed":{"decision":"allow","failure_code":null},"result":"pass"},{"adapter":"generic","errors":[],"expected":{"decision":"allow","failure_code":null},"fixture":"adapters/fixtures/satire.json","fixture_sha256":"bbbae132a80884dae2471bf18ce492c21efa5d7a971bb14d3931047648ab8c72","observed":{"decision":"allow","failure_code":null},"result":"pass"},{"adapter":"openai","errors":[],"expected":{"decision":"allow","failure_code":null},"fixture":"adapters/fixtures/satire.json","fixture_sha256":"bbbae132a80884dae2471bf18ce492c21efa5d7a971bb14d3931047648ab8c72","observed":{"decision":"allow","failure_code":null},"result":"pass"},{"adapter":"ollama","errors":[],"expected":{"decision":"allow","failure_code":null},"fixture":"adapters/fixtures/satire.json","fixture_sha256":"bbbae132a80884dae2471bf18ce492c21efa5d7a971bb14d3931047648ab8c72","observed":{"decision":"allow","failure_code":null},"result":"pass"},{"adapter":"generic","errors":[],"expected":{"decision":"block","failure_code":"INT_CROSS_MODE_BRIDGE_REQUIRED"},"fixture":"adapters/fixtures/cross-mode.json","fixture_sha256":"fcd4b361abf8f4e0bc1179bf2216053bb19d06198ca0ec5f6f652f524829d982","observed":{"decision":"block","failure_code":"INT_CROSS_MODE_BRIDGE_REQUIRED"},"result":"pass"},{"adapter":"openai","errors":[],"expected":{"decision":"block","failure_code":"INT_CROSS_MODE_BRIDGE_REQUIRED"},"fixture":"adapters/fixtures/cross-mode.json","fixture_sha256":"fcd4b361abf8f4e0bc1179bf2216053bb19d06198ca0ec5f6f652f524829d982","observed":{"decision":"block","failure_code":"INT_CROSS_MODE_BRIDGE_REQUIRED"},"result":"pass"},{"adapter":"ollama","errors":[],"expected":{"decision":"block","failure_code":"INT_CROSS_MODE_BRIDGE_REQUIRED"},"fixture":"adapters/fixtures/cross-mode.json","fixture_sha256":"fcd4b361abf8f4e0bc1179bf2216053bb19d06198ca0ec5f6f652f524829d982","observed":{"decision":"block","failure_code":"INT_CROSS_MODE_BRIDGE_REQUIRED"},"result":"pass"},{"adapter":"generic","errors":[],"expected":{"decision":"reject","failure_code":"INT_ADAPTER_PROVENANCE_REQUIRED"},"fixture":"adapters/fixtures/missing-provenance.json","fixture_sha256":"9c85d6c9afc780657f1ca7cab7a4f93562d0dbb6507c5708e7059de73c28d184","observed":{"decision":"reject","failure_code":"INT_ADAPTER_PROVENANCE_REQUIRED"},"result":"pass"},{"adapter":"openai","errors":[],"expected":{"decision":"reject","failure_code":"INT_ADAPTER_PROVENANCE_REQUIRED"},"fixture":"adapters/fixtures/missing-provenance.json","fixture_sha256":"9c85d6c9afc780657f1ca7cab7a4f93562d0dbb6507c5708e7059de73c28d184","observed":{"decision":"reject","failure_code":"INT_ADAPTER_PROVENANCE_REQUIRED"},"result":"pass"},{"adapter":"ollama","errors":[],"expected":{"decision":"reject","failure_code":"INT_ADAPTER_PROVENANCE_REQUIRED"},"fixture":"adapters/fixtures/missing-provenance.json","fixture_sha256":"9c85d6c9afc780657f1ca7cab7a4f93562d0dbb6507c5708e7059de73c28d184","observed":{"decision":"reject","failure_code":"INT_ADAPTER_PROVENANCE_REQUIRED"},"result":"pass"},{"adapter":"generic","errors":[],"expected":{"decision":"allow","failure_code":null},"fixture":"adapters/fixtures/drift.json","fixture_sha256":"7a80515c9fdd1a55b4af0d1a4ab7399bd9e9f4ddba9ec739df0e7a753f53fc78","observed":{"decision":"allow","failure_code":null},"result":"pass"},{"adapter":"openai","errors":[],"expected":{"decision":"allow","failure_code":null},"fixture":"adapters/fixtures/drift.json","fixture_sha256":"7a80515c9fdd1a55b4af0d1a4ab7399bd9e9f4ddba9ec739df0e7a753f53fc78","observed":{"decision":"allow","failure_code":null},"result":"pass"},{"adapter":"ollama","errors":[],"expected":{"decision":"allow","failure_code":null},"fixture":"adapters/fixtures/drift.json","fixture_sha256":"7a80515c9fdd1a55b4af0d1a4ab7399bd9e9f4ddba9ec739df0e7a753f53fc78","observed":{"decision":"allow","failure_code":null},"result":"pass"},{"adapter":"generic","errors":[],"expected":{"decision":"reject","failure_code":"INT_ADAPTER_ENVELOPE_INVALID"},"fixture":"adapters/fixtures/invalid.json","fixture_sha256":"950cdacc10d944c279171d8e3e4c22c0cb03e0eef8ba1706c39e4b936833e68c","observed":{"decision":"reject","failure_code":"INT_ADAPTER_ENVELOPE_INVALID"},"result":"pass"},{"adapter":"openai","errors":[],"expected":{"decision":"reject","failure_code":"INT_ADAPTER_ENVELOPE_INVALID"},"fixture":"adapters/fixtures/invalid.json","fixture_sha256":"950cdacc10d944c279171d8e3e4c22c0cb03e0eef8ba1706c39e4b936833e68c","observed":{"decision":"reject","failure_code":"INT_ADAPTER_ENVELOPE_INVALID"},"result":"pass"},{"adapter":"ollama","errors":[],"expected":{"decision":"reject","failure_code":"INT_ADAPTER_ENVELOPE_INVALID"},"fixture":"adapters/fixtures/invalid.json","fixture_sha256":"950cdacc10d944c279171d8e3e4c22c0cb03e0eef8ba1706c39e4b936833e68c","observed":{"decision":"reject","failure_code":"INT_ADAPTER_ENVELOPE_INVALID"},"result":"pass"}],"summary":{"adapter_count":3,"failed":0,"fixture_count":8,"passed":24,"total":24},"type":"qsol-int-adapter-conformance-report","version":"1.0.0"}
